{
  "policy_version": "1.0.0",
  "policy_id": "tbp_synthjoin2026",
  "operation": "join",
  "coordinate_system": "unicode-codepoint-index-v1",
  "review_state": "synthetic-reviewed",
  "sources": [
    {
      "ordinal": 1,
      "source_reference": "SYN 2:1",
      "text_sha256": "a151ceb1711aad529a7704248f03333990022ebbfa07a7f04c004d70c167919f"
    },
    {
      "ordinal": 2,
      "source_reference": "SYN 2:2",
      "text_sha256": "8b88a85089561b7978c4e52c3150112912125f3d34ec59b6ff1450fc1079979c"
    }
  ],
  "target_reference": "SYN 2:1",
  "separator": " ",
  "output_text_sha256": "8fa7ec98c453bc8a99b0ffa4a72a96a044699ffc23979a22245979b1779cb517",
  "publication_eligible": false
}
