{
  "policy_version": "1.0.0",
  "policy_id": "tbp_synthsplit2026",
  "operation": "split",
  "coordinate_system": "unicode-codepoint-index-v1",
  "review_state": "synthetic-reviewed",
  "source_reference": "SYN 1:1",
  "source_text_sha256": "cad4c5623efc0ae67dbe8274e7ffc184ca91df37a8e844624240f8eef1300ce7",
  "coverage": "full-no-gaps-no-overlap",
  "components": [
    {
      "ordinal": 1,
      "target_reference": "SYN 1:1",
      "start": 0,
      "end": 5,
      "text_sha256": "a151ceb1711aad529a7704248f03333990022ebbfa07a7f04c004d70c167919f"
    },
    {
      "ordinal": 2,
      "target_reference": "SYN 1:2",
      "start": 5,
      "end": 11,
      "text_sha256": "8b88a85089561b7978c4e52c3150112912125f3d34ec59b6ff1450fc1079979c"
    }
  ],
  "publication_eligible": false
}
